<?xml version="1.0"?>
<!-- <!DOCTYPE tilemap SYSTEM "dtd/tilemap.dtd">-->
<!-- $Id$ -->

<tilemap name="dungeon">   
    <map frames="16" tile="brick_floor"/>
    <map frames="16" tile="up_ladder"/>
    <map frames="16" tile="down_ladder"/>
    <map frames="16" tile="up_down_ladder"/>
    <map frames="16" tile="chest"/>
    <map frames="16" tile="ceiling_hole"/>
    <map frames="16" tile="floor_hole"/>
    <map frames="16" tile="magic_orb"/>
    
    <map frames="16" tile="ceiling_hole"/>
    <!--
    <map tile="wind_trap"/>
    <map tile="falling_rock_trap"/>
    <map frames="12" tile="brick_floor"/>
    <map tile="pit_trap"/>
    <map tile="dungeon_floor"/>
    -->

    <map frames="16" tile="fountain"/>
    <!--
    <map tile="fountain_normal"/>
    <map tile="fountain_healing"/>
    <map tile="fountain_acid"/>
    <map tile="fountain_cure"/>
    <map tile="fountain_poison"/>
    <map frames="11" tile="brick_floor"/>
    -->

    <map tile="poison_field"/>
    <map tile="energy_field"/>
    <map tile="fire_field"/>
    <map tile="sleep_field"/>
    <map frames="12" tile="brick_floor"/> <!-- unused fields -->
    <map frames="16" tile="dungeon_altar"/>
    <map frames="16" tile="dungeon_door"/>
    <map frames="16" tile="dungeon_room"/>
    <map frames="16" tile="secret_door"/>
    <map frames="16" tile="brick_wall"/>
</tilemap>
